{
  "schema": "ihat://identity/subject-link/v1",
  "id": "subject-link/nerp-001",
  "revision": 1,
  "created_at": "2026-08-03T01:00:00.000Z",
  "updated_at": "2026-08-03T01:00:20.000Z",
  "digest": "sha256:5bbd9635ea94ddcfc6948aaef25ec28e3943ba62ea9afc16f5aec37998fc07dd",
  "subject_id": "subject/person-001",
  "relying_party_id": "nerp",
  "issuer": "https://login.microsoftonline.invalid/example-tenant/v2.0",
  "provider_subject": "entra-subject-opaque-001",
  "pairwise_subject": "pairwise_nerp_subject_001",
  "linking_method": "dual-authenticated",
  "assurance": "phishing-resistant",
  "status": "active",
  "linked_at": "2026-08-03T01:00:05.000Z",
  "last_verified_at": "2026-08-03T01:00:20.000Z",
  "revocation_epoch": 0
}
